Marca,Desc_Producto,Precio,URL_Producto
GIGABYTE, Z390 AORUS PRO LGA 1151 (300 Series) Intel Z390 HDMI SATA 6Gb/s USB 3.1 ATX Intel Motherboard, 270, https://www.newegg.com/p/N82E16813145098?Description=MotherBoard&cm_re=MotherBoard-_-13-145-098-_-Product
ASUS, ROG STRIX Z590-A GAMING WIFI LGA 1200 Intel Z590 SATA 6Gb/s ATX Intel Motherboard, 254, https://www.newegg.com/asus-rog-strix-z590-a-gaming-wifi/p/N82E16813119371R?Description=MotherBoard&cm_re=MotherBoard-_-13-119-371R-_-Product
X79-ZD3, REV2.0 Motherboard For Intel C602 X79 LGA 2011 ECC REG DDR3 1866MHz 128GB M.2 NVME NGFF M-ATX Server Mainboard, 145, https://www.newegg.com/p/1JW-00HZ-00002?Description=MotherBoard&cm_re=MotherBoard-_-1JW-00HZ-00002-_-Product
MSI, MEG Z390 ACE LGA 1151 (300 Series) Intel Z390 SATA 6Gb/s USB 3.1 ATX Intel Motherboard, 405, https://www.newegg.com/p/N82E16813144210?Description=MotherBoard&cm_re=MotherBoard-_-13-144-210-_-Product
Fractal, Design Define 7 XL Black Brushed Aluminum / Steel E-ATX Silent Modular Full Tower Computer Case, 224, https://www.newegg.com/black-fractal-design-define-7-xl-atx-full-tower/p/N82E16811352118?Description=MotherBoard&cm_re=MotherBoard-_-11-352-118-_-Product
ASRock, B560M PRO4/AC LGA 1200 Intel B560 SATA 6Gb/s Micro ATX Intel Motherboard, 130, https://www.newegg.com/p/N82E16813157979?Description=MotherBoard&cm_re=MotherBoard-_-13-157-979-_-Product
ASUS, Prime Z690-P WiFi LGA 1700 Intel 12th Gen ATX Motherboard- PCIe 5.0| DDR5| 14+1 Power Stages| 3x M.2| WiFi 6| Bluetooth v5.2| 2.5Gb LAN| Front Panel USB 3.2 Gen 1 Type-C| Thunderbolt 4 Support, 203, https://www.newegg.com/p/N82E16813119509R?Description=MotherBoard&cm_re=MotherBoard-_-13-119-509R-_-Product
ASUS, ROG MAXIMUS XIII EXTREME LGA 1200 Intel Z590 SATA 6Gb/s Extended ATX Intel Motherboard, 840, https://www.newegg.com/asus-rog-maximus-xiii-extreme/p/N82E16813119417?Description=MotherBoard&cm_re=MotherBoard-_-13-119-417-_-Product
ASUS, ROG STRIX B450-F GAMING AM4 AMD B450 SATA 6Gb/s ATX AMD Motherboard, NA, https://www.newegg.com/asus-rog-strix-b450-f-gaming/p/N82E16813119140?Description=MotherBoard&cm_re=MotherBoard-_-13-119-140-_-Product
GIGABYTE, Z590 AORUS ELITE LGA 1200 Intel Z590 ATX Motherboard with Triple M.2| PCIe 4.0| USB 3.2 Gen2X2 Type-C| 2.5GbE LAN, 169, https://www.newegg.com/p/N82E16813145264?Description=MotherBoard&cm_re=MotherBoard-_-13-145-264-_-Product
CORSAIR, Vengeance RGB Pro 32GB (4 x 8GB) 288-Pin DDR4 DRAM DDR4 3600 (PC4 28800) Desktop Memory Model CMW32GX4M4C3600C18W, 184, https://www.newegg.com/corsair-32gb-288-pin-ddr4-sdram/p/N82E16820236405?Description=MotherBoard&cm_re=MotherBoard-_-20-236-405-_-Product
CORSAIR, Vengeance RGB Pro 16GB (2 x 8GB) 288-Pin DDR4 DRAM DDR4 3200 (PC4 25600) Desktop Memory Model CMW16GX4M2C3200C16, 84, https://www.newegg.com/corsair-16gb-288-pin-ddr4-sdram/p/N82E16820236417?Description=MotherBoard&cm_re=MotherBoard-_-20-236-417-_-Product
ASUS, ROG STRIX Z390-F GAMING LGA 1151 (300 Series) Intel Z390 HDMI SATA 6Gb/s USB 3.1 ATX Intel Motherboard, 182, https://www.newegg.com/asus-rog-strix-z390-f-gaming/p/N82E16813119176?Description=MotherBoard&cm_re=MotherBoard-_-13-119-176-_-Product
Cooler, Master MasterBox Q300L Micro ATX Tower w/ Magnetic Design Dust Filter| Transparent Acrylic Side Panel| Adjustable I/O & Fully Ventilated for Airflow| MCB-Q300L-KANN-S00, 66, https://www.newegg.com/black-cooler-master-masterbox-q300l-micro-atx/p/N82E16811119331?Description=MotherBoard&cm_re=MotherBoard-_-11-119-331-_-Product
GIGABYTE, GA-H110-D3A (rev. 1.0) LGA 1151 Intel H110 SATA 6Gb/s USB 3.1 ATX Intel Motherboard for Cryptocurrency Mining (BTC), NA, https://www.newegg.com/p/N82E16813145016?Description=MotherBoard&cm_re=MotherBoard-_-13-145-016-_-Product
ASUS, PRO Q570M-C/CSM LGA 1200 Intel Q570 SATA 6Gb/s Micro ATX Intel Motherboard, 158, https://www.newegg.com/p/N82E16813119434?Description=MotherBoard&cm_re=MotherBoard-_-13-119-434-_-Product
ASUS, ROG STRIX Z490-E GAMING LGA 1200 Intel Z490 SATA 6Gb/s ATX Intel Motherboard, 285, https://www.newegg.com/asus-rog-strix-z490-e-gaming/p/N82E16813119268?Description=MotherBoard&cm_re=MotherBoard-_-13-119-268-_-Product
ASUS, M5A78L LE AM3+ AMD AM3+ AMD 760G ATX AMD Motherboard, 96, https://www.newegg.com/asus-facoty-stock-goods-never-been-used-or-repaired-in-perfect-condition-m5a78l-le/p/2MG-003A-00004?Description=MotherBoard&cm_re=MotherBoard-_-2MG-003A-00004-_-Product
ASUS, H81M-K LGA 1150 Intel H81 SATA 6Gb/s USB 3.1 uATX Intel Motherboard, 89, https://www.newegg.com/p/N82E16813132052?Description=MotherBoard&cm_re=MotherBoard-_-13-132-052-_-Product
ASUS, PRIME TRX40-PRO sTRX4 AMD TRX40 SATA 6Gb/s ATX AMD Motherboard, 613, https://www.newegg.com/asus-prime-trx40-pro/p/N82E16813119219?Description=MotherBoard&cm_re=MotherBoard-_-13-119-219-_-Product
CORSAIR, Vengeance RGB Pro 32GB (4 x 8GB) 288-Pin DDR4 DRAM DDR4 3200 (PC4 25600) Desktop Memory Model CMW32GX4M4C3200C16W, 169, https://www.newegg.com/corsair-32gb-288-pin-ddr4-sdram/p/N82E16820236407?Description=MotherBoard&cm_re=MotherBoard-_-20-236-407-_-Product
GIGABYTE, X570S AORUS ELITE (rev. 1.0) AMD Ryzen 3000 PCIe 4.0 SATA 6Gb/s USB 3.2 AMD X570S ATX Motherboard, 229, https://www.newegg.com/gigabyte-x570s-aorus-elite/p/N82E16813145379?Description=MotherBoard&cm_re=MotherBoard-_-13-145-379-_-Product
GIGABYTE, A520M DS3H AC AM4 AMD 520 ATX Motherboard with Single M.2| SATA 6Gb/s| USB 3.2 Gen 1| WIFI 802.11a| Realtek GbE LAN, 79, https://www.newegg.com/gigabyte-a520m-ds3h-ac/p/1HD-0002-001E0?Description=MotherBoard&cm_re=MotherBoard-_-1HD-0002-001E0-_-Product
Thermaltake, View 51 Motherboard Sync ARGB E-ATX Full Tower Gaming Computer Case with 2 x 200mm ARGB 5V Motherboard Sync RGB Fans + 140mm Black Rear Fan Pre-Installed| CA-1Q6-00M1WN-00, 188, https://www.newegg.com/black-thermaltake-view-51-tempered-glass-argb-edition-atx-full-tower/p/N82E16811133427?Description=MotherBoard&cm_re=MotherBoard-_-11-133-427-_-Product
Antec, Performance Series P120 Crystal White| Aluminum VGA Holder Included| Slide Button Design| Tempered Glass Front & Side Panels| Ready for 2 x 360mm Radiators Simultaneously| E-ATX Mid-Tower Case, 134, https://www.newegg.com/p/N82E16811129275?Description=MotherBoard&cm_re=MotherBoard-_-11-129-275-_-Product
MSI, H510M PRO LGA 1200 Intel H510 SATA 6Gb/s Micro ATX Intel Motherboard, 89, https://www.newegg.com/p/N82E16813144401?Description=MotherBoard&cm_re=MotherBoard-_-13-144-401-_-Product
GIGABYTE, B460M DS3H V2 (rev 1.0) LGA 1200 Intel B460 Micro-ATX Motherboard with M.2| SATA 6Gb/s| USB 3.2 Gen 1, 169, https://www.newegg.com/p/N82E16813145298?Description=MotherBoard&cm_re=MotherBoard-_-13-145-298-_-Product
Original, HP / HP IPMMB-FM 696399-002 Z75 motherboard LGA1155, 79, https://www.newegg.com/p/1HD-0080-00003?Description=MotherBoard&cm_re=MotherBoard-_-9SIAME0AS71781-_-Product
JONSBO, MechWarrior MOD-3 Gaming Computer Case Support XL-ATX Motherboard 360mm Liquid Cooler Front Panel with 5V ARGB Lighting USB 3.0 *2 White, 399, https://www.newegg.com/white-jonsbo-mechwarrior-atx-open-frame-chassis/p/2AM-006A-00020?Description=MotherBoard&cm_re=MotherBoard-_-9SIAGKCBUD4435-_-Product
ASUS, AM4 TUF Gaming X570-Plus (Wi-Fi) ATX Motherboard with PCIe 4.0| Dual M.2| 12+2 with Dr. MOS Power Stage| HDMI| DP| SATA 6Gb/s| USB 3.2 Gen 2 and Aura Sync RGB Lighting, 171, https://www.newegg.com/asus-tuf-gaming-x570-plus/p/N82E16813119197R?Description=MotherBoard&cm_re=MotherBoard-_-13-119-197R-_-Product
GIGABYTE, Z590 VISION D LGA 1200 Intel Z590 ATX Motherboard with Triple M.2| PCIe 4.0| USB 3.2 Gen2X2 Type-C| Intel WIFI 6| Dual 2.5GbE LAN| Intel Thunderbolt 4, 311, https://www.newegg.com/p/N82E16813145294?Description=MotherBoard&cm_re=MotherBoard-_-13-145-294-_-Product
ASUS, PRIME B550-PLUS AM4 ATX AMD Motherboard, 135, https://www.newegg.com/asus-prime-b550-plus/p/N82E16813119323
MSI, MPG Z590 GAMING FORCE LGA 1200 ATX Intel Motherboard, 217, https://www.newegg.com/p/N82E16813144386
GIGABYTE, X570 AORUS ELITE WIFI AM4 ATX AMD Motherboard, 179, https://www.newegg.com/gigabyte-x570-aorus-elite-wifi/p/N82E16813145165
ASUS, Prime X570-P Ryzen 3 AM4 with PCIe Gen4| Dual M.2 HDMI| SATA 6Gb/s USB 3.2 Gen 2 ATX Motherboard, 152, https://www.newegg.com/asus-prime-x570-p/p/N82E16813119199
GIGABYTE, Z490 GAMING X AX LGA 1200 Intel Z490 SATA 6Gb/s ATX Intel Motherboard, 219, https://www.newegg.com/p/N82E16813145227?Description=MotherBoard&cm_re=MotherBoard-_-13-145-227-_-Product
X79M-S, V2.0 Computer Motherboard Support E5 E5 2620 2689 2690 2630 With 4*DDR3 Slot with SATA USB 2.0 M.2 NVME Slot, 99, https://www.newegg.com/p/1JW-00M7-00005?Description=MotherBoard&cm_re=MotherBoard-_-9SIAMNYG7K9648-_-Product
CORSAIR, Vengeance RGB Pro SL 16GB (2 x 8GB) 288-Pin DDR4 SDRAM DDR4 3600 (PC4 28800) Intel XMP 2.0 Desktop Memory Model CMH16GX4M2D3600C18W, 91, https://www.newegg.com/corsair-16gb-288-pin-ddr4-sdram/p/N82E16820236702?Description=MotherBoard&cm_re=MotherBoard-_-20-236-702-_-Product
GIGABYTE, A520I AC mITX AM4 Direct 6 Phases Digital PWM with 55A DrMOS| GIGABYTE Gaming GbE LAN| Intel WiFi+Bluetooth| NVMe PCIe 3.0 x4 M.2| 3 Display Interfaces| Q-Flash Plus| Motherboard, 147, https://www.newegg.com/gigabyte-a520i-ac/p/N82E16813145239?Description=MotherBoard&cm_re=MotherBoard-_-13-145-239-_-Product
MSI, PERFORMANCE GAMING B450I GAMING PLUS AC AM4 AMD B450 SATA 6Gb/s Mini ITX AMD Motherboard, 142, https://www.newegg.com/msi-performance-gaming-b450i-gaming-plus-ac/p/N82E16813144190?Description=MotherBoard&cm_re=MotherBoard-_-13-144-190-_-Product
ASUS, ROG STRIX B360-F GAMING LGA1151 (300 Series) DDR4 DP HDMI DVI M.2 ATX Motherboard, NA, https://www.newegg.com/asus-rog-strix-b360-f-gaming/p/N82E16813119077?Description=MotherBoard&cm_re=MotherBoard-_-13-119-077-_-Product
ASUS, Z170-A LGA 1151 Intel Z170 HDMI SATA 6Gb/s USB 3.1 USB 3.0 ATX Intel Motherboard, NA, https://www.newegg.com/p/N82E16813132566?Description=MotherBoard&cm_re=MotherBoard-_-13-132-566-_-Product
ASUS, B250 MINING EXPERT LGA 1151 Intel B250 HDMI SATA 6Gb/s USB 3.1 ATX Intel Cryptocurrency Mining Motherboard, 780, https://www.newegg.com/asus-131206-b250-mining-expert/p/N82E16813119028?Description=MotherBoard&cm_re=MotherBoard-_-13-119-028-_-Product
HUANANZHI, X99 8M X99 Motherboard with Intel XEON E5 2620 v3 combo kit set LGA2011-3 All Series NON-ECC memory NVME SATA USB3.0, 169, https://www.newegg.com/p/1JW-00NX-00011?Description=MotherBoard&cm_re=MotherBoard-_-9SIB1N8HTS2735-_-Product
Cooler, Master MasterCase H500 ARGB Airflow ATX Mid-Tower with Mesh and Transparent Front Panel Option| Dual 200mm ARGB Lighting Fans| and Tempered Glass, 103, https://www.newegg.com/gunmetal-cooler-master-mastercase-h500-atx-mid-tower/p/N82E16811119350?Description=MotherBoard&cm_re=MotherBoard-_-11-119-350-_-Product
Fractal, Design Define 7 XL Black Brushed Aluminum / Steel E-ATX Silent Modular Dark Tinted Tempered Glass Window Full Tower Computer Case, 234, https://www.newegg.com/black-fractal-design-define-7-xl-atx-full-tower/p/N82E16811352120?Description=MotherBoard&cm_re=MotherBoard-_-11-352-120-_-Product
DIYPC, IDX1-W-ARGB White Steel / Tempered Glass ATX Mid Tower Computer Case with 1 x 120mm Halo ARGB LED Fan Pre-Installed, 69, https://www.newegg.com/p/N82E16811353196?Description=MotherBoard&cm_re=MotherBoard-_-11-353-196-_-Product
Fractal, Design Torrent Compact Black TG Dark Tempered Glass High-Airflow ATX Computer Case, 149, https://www.newegg.com/black-fractal-design-torrent-compact-atx-mid-tower/p/N82E16811352149?Description=MotherBoard&cm_re=MotherBoard-_-11-352-149-_-Product
MSI, PERFORMANCE GAMING X470 GAMING PLUS AM4 AMD X470 SATA 6Gb/s USB 3.1 HDMI ATX AMD Motherboard, 128, https://www.newegg.com/msi-performance-gaming-x470-gaming-plus/p/N82E16813144177?Description=MotherBoard&cm_re=MotherBoard-_-13-144-177-_-Product
CORSAIR, Vengeance RGB Pro SL 16GB (2 x 8GB) 288-Pin DDR4 SDRAM DDR4 3200 (PC4 25600) Intel XMP 2.0 Desktop Memory Model CMH16GX4M2E3200C16, 78, https://www.newegg.com/corsair-16gb-288-pin-ddr4-sdram/p/N82E16820236703?Description=MotherBoard&cm_re=MotherBoard-_-20-236-703-_-Product
Fractal, Design Define 7 Black Brushed Aluminum / Steel E-ATX Silent Modular Dark Tinted Tempered Glass Window Mid Tower Computer Case, 189, https://www.newegg.com/black-fractal-design-define-7-atx-mid-tower/p/N82E16811352111?Description=MotherBoard&cm_re=MotherBoard-_-11-352-111-_-Product
Antec, Dark League DP502 FLUX White| Mid-Tower ATX Gaming Case| FLUX Platform| 5 x 120mm Fans Included| PWM Fans with Controller| 5.25" ODD Support| Tempered Glass Side Panel| Swing Open Front Panel, 104, https://www.newegg.com/white-antec-dark-phantom-atx-mid-tower/p/N82E16811129271?Description=MotherBoard&cm_re=MotherBoard-_-11-129-271-_-Product
LIAN, LI Q58 Black Color  SPCC / Aluminum / Tempered Glass  Mini Tower Computer Case | PCI4.0 Riser Card Cable Included ---Q58X4, 159, https://www.newegg.com/p/2AM-000Z-00084?Description=MotherBoard&cm_re=MotherBoard-_-2AM-000Z-00084-_-Product
CORSAIR, Vengeance RGB Pro SL 16GB (2 x 8GB) 288-Pin DDR4 SDRAM DDR4 3200 (PC4 25600) Intel XMP 2.0 Desktop Memory Model CMH16GX4M2E3200C16W, 83, https://www.newegg.com/corsair-16gb-288-pin-ddr4-sdram/p/N82E16820236704?Description=MotherBoard&cm_re=MotherBoard-_-20-236-704-_-Product
MSI, B550M PRO-VDH WIFI6 AM4 AMD B550 SATA 6Gb/s Micro ATX AMD Motherboard, 94, https://www.newegg.com/msi-b550m-pro-vdh-wifi6/p/N82E16813144516?Description=MotherBoard&cm_re=MotherBoard-_-13-144-516-_-Product
MSI, MAG Z390M MORTAR LGA 1151 (300 Series) Intel Z390 HDMI SATA 6Gb/s USB 3.1 Micro ATX Intel Motherboard, 177, https://www.newegg.com/p/N82E16813144218?Description=MotherBoard&cm_re=MotherBoard-_-13-144-218-_-Product
Rosewill, RANGER-M - Dual-Fan Micro ATX Mini Tower Computer Case with Blue LED Lighting, 59, https://www.newegg.com/p/N82E16811147122?Description=MotherBoard&cm_re=MotherBoard-_-11-147-122-_-Product
Gigabyte, HD3 Intel B365 LGA 1151 Micro ATX DDR4-SDRAM Motherboard, 117, https://www.newegg.com/p/1HD-0002-000H4?Description=MotherBoard&cm_re=MotherBoard-_-1HD-0002-000H4-_-Product
Biostar, TB360-BTC D+ LGA1151 SODIMM DDR4 8 GPU Support GPU ATX Motherboard for Cryptocurrency Mining (BTC), 252, https://www.newegg.com/biostar-tb360-btc-d-lga1151-sodimm-ddr4/p/1JW-0007-000E1?Description=MotherBoard&cm_re=MotherBoard-_-1JW-0007-000E1-_-Product
MSI, B360M MORTAR TITANIUM LGA 1151 (300 Series) Intel B360 HDMI SATA 6Gb/s Micro ATX Intel Motherboard, 104, https://www.newegg.com/p/N82E16813144158?Description=MotherBoard&cm_re=MotherBoard-_-13-144-158-_-Product
Intel, BLKNUC7i5BNB Core i5 i5-7260U 3.4GHz DDR4 UCFF NUC Motherboard, 399, https://www.newegg.com/p/1JW-000T-008H7?Description=MotherBoard&cm_re=MotherBoard-_-9SIAJZYFYZ7760-_-Product
MSI, MEG Z390 GODLIKE LGA 1151 (300 Series) Intel Z390 SATA 6Gb/s USB 3.1 Extended ATX Intel Motherboard, 632, https://www.newegg.com/p/N82E16813144209?Description=MotherBoard&cm_re=MotherBoard-_-13-144-209-_-Product
MSI, B450 TOMAHAWK MAX II AM4 AMD B450 SATA 6Gb/s ATX AMD Motherboard, 104, https://www.newegg.com/msi-b450-tomahawk-max-ii/p/2MG-000M-00336?Description=MotherBoard&cm_re=MotherBoard-_-2MG-000M-00336-_-Product
HUANANZHI, B85 M-ATX Desktop Motherboard CPU 1150 Core i3 i5 i7 Socket 1150 DDR3 VGA+DVI+HDMI  + CPU I5 4460 Solution Combo, 288, https://www.newegg.com/huananzhi-b85m-atx/p/1JW-00D3-00014?Description=MotherBoard&cm_re=MotherBoard-_-1JW-00D3-00014-_-Product
Thermaltake, View 51 Snow Motherboard Sync ARGB E-ATX Full Tower Gaming Computer Case with 2 200mm ARGB 5V Motherboard Sync RGB Fans + 140mm Black Rear Fan Pre-Installed CA-1Q6-00M6WN-00, 239, https://www.newegg.com/white-thermaltake-view-51-tempered-glass-snow-argb-edition-atx-full-tower/p/N82E16811133428?Description=MotherBoard&cm_re=MotherBoard-_-11-133-428-_-Product
Dell, Precision T1700 Intel C226 LGA1150 DDR3 Desktop System Motherboard 4JGCK 04JGCK CN-04JGCK, 45, https://www.newegg.com/p/1JW-000H-023F3?Description=MotherBoard&cm_re=MotherBoard-_-9SIA9AXH724561-_-Product
ASUS, X79 DELUXE LGA 2011 Intel X79 SATA 6Gb/s USB 3.0 ATX Intel Motherboard, 457, https://www.newegg.com/p/1JW-00EE-00004?Description=MotherBoard&cm_re=MotherBoard-_-1JW-00EE-00004-_-Product
ASRock, Z690 AQUA OC LGA 1700 DDR5 Intel Z690 SATA 6Gb/s Extended ATX Intel Motherboard, 1399, https://www.newegg.com/p/N82E16813162036?Description=MotherBoard&cm_re=MotherBoard-_-13-162-036-_-Product
BTC-D37, GPU Miner Mobo Mining Motherboard Integrated 8GPU Slot DDR3 Memory Type VGA HDMI PCIE 16X Bitcoin Motherboard, 198, https://www.newegg.com/p/1JW-00K9-00009?Description=MotherBoard&cm_re=MotherBoard-_-9SIAUUEEM82606-_-Product
H110, LGA1151 DDR4 Motherboard 16GB dual channel Mainboard (4SATA), 74, https://www.newegg.com/p/1JW-003D-00015?Description=MotherBoard&cm_re=MotherBoard-_-9SIAGSH8KE5336-_-Product
SUPERMICRO, MBD-C7B250-CB-ML-O LGA 1151 Intel B250 HDMI SATA 6Gb/s USB 3.0 Micro ATX Motherboard, 152, https://www.newegg.com/p/N82E16813183619?Description=MotherBoard&cm_re=MotherBoard-_-13-183-619-_-Product
For, Intel Trusted Platform Module 14 Pin TPM 2.0 Module, 30, https://www.newegg.com/p/1JW-00NH-00006
ASUS, AT4NM10T-I Intel NM10 Mini ITX Intel Motherboard, 39, https://www.newegg.com/p/1JW-000C-00W42
ASUS, H61M-CS LGA1155 DDR3 Intel H61 SATA3 USB2.0 Micro ATX Intel Motherboard, 54, https://www.newegg.com/p/1JW-000C-00W49
MSI, H81M-P33 LGA 1150 Intel H81 SATA 6Gb/s USB 3.0 Micro ATX Intel Motherboard, 55, https://www.newegg.com/p/1JW-001M-000D7
Gigabyte, B365M AORUS ELITE motherboard LGA 1151 DDR4 64GB M.2 USB3.1 USB2.0 DVI HDMI B365 desktop motherboards, 267, https://www.newegg.com/p/1JW-000J-00262?Description=MotherBoard&cm_re=MotherBoard-_-1JW-000J-00262-_-Product
ASUS, Prime X470-Pro AM4 AMD X470 SATA 6Gb/s ATX AMD Motherboard, NA, https://www.newegg.com/asus-prime-x470-pro/p/N82E16813119100?Description=MotherBoard&cm_re=MotherBoard-_-13-119-100-_-Product
MSI, MPG Z390 GAMING PRO CARBON AC LGA 1151 (300 Series) Intel Z390 HDMI SATA 6Gb/s USB 3.1 ATX Intel Motherboard, NA, https://www.newegg.com/p/N82E16813144211?Description=MotherBoard&cm_re=MotherBoard-_-13-144-211-_-Product
ASUS, PRIME B460-PLUS LGA 1200 Intel B460 SATA 6Gb/s ATX Intel Motherboard, 198, https://www.newegg.com/p/N82E16813119298?Description=MotherBoard&cm_re=MotherBoard-_-13-119-298-_-Product
MSI, MEG Z590 ACE GOLD EDITION LGA 1200 Intel Z590 SATA 6Gb/s ATX Intel Motherboard, 339, https://www.newegg.com/p/N82E16813144459?Description=MotherBoard&cm_re=MotherBoard-_-13-144-459-_-Product
ASUS, B250 MINING EXPERT Intel LGA B250 1151 ATX Desktop Motherboard A, 448, https://www.newegg.com/p/1JW-000C-00413?Description=MotherBoard&cm_re=MotherBoard-_-1JW-000C-00413-_-Product
ASUS, ROG Strix X299-E Gaming II LGA 2066 Intel X299 SATA 6Gb/s ATX Intel Motherboard, 645, https://www.newegg.com/asus-rog-strix-x299-e-gaming-ii/p/N82E16813119215?Description=MotherBoard&cm_re=MotherBoard-_-13-119-215-_-Product
JONSBO, MechWarrior MOD-3 Gaming Computer Case Support XL-ATX Motherboard 360mm Liquid Cooler Front Panel with 5V ARGB Lighting USB 3.0 *2, 369, https://www.newegg.com/gray-jonsbo-mechwarrior-atx-open-frame-chassis/p/2AM-006A-00008?Description=MotherBoard&cm_re=MotherBoard-_-9SIAGKCAG50046-_-Product
X79, motherboard LGA2011 ATX USB3.0 SATA3 PCI-E NVME M.2 SSD support REG ECC memory and Xeon E5 processor, 179, https://www.newegg.com/p/1JW-00N7-00012?Description=MotherBoard&cm_re=MotherBoard-_-9SIB601H310244-_-Product
CORSAIR, Vengeance RGB Pro 64GB (2 x 32GB) 288-Pin DDR4 SDRAM DDR4 3600 (PC4 28800) Intel XMP 2.0 Desktop Memory Model CMW64GX4M2D3600C18, 319, https://www.newegg.com/corsair-64gb-288-pin-ddr4-sdram/p/N82E16820236602?Description=MotherBoard&cm_re=MotherBoard-_-20-236-602-_-Product
CORSAIR, Vengeance RGB Pro 128GB (4 x 32GB) 288-Pin DDR4 SDRAM DDR4 3600 (PC4 28800) Intel XMP 2.0 Desktop Memory Model CMW128GX4M4D3600C18, 629, https://www.newegg.com/corsair-128gb-288-pin-ddr4-sdram/p/N82E16820236613?Description=MotherBoard&cm_re=MotherBoard-_-20-236-613-_-Product
C24, Yellow Portable MINI Computer Case (Support ITX Motherboard/A4 Aluminum/Side-Opening Glass Side Through), 164, https://www.newegg.com/p/2AM-00GU-00019?Description=MotherBoard&cm_re=MotherBoard-_-9SIA4REC711102-_-Product
Phanteks, Enthoo Pro 2 Full Tower| High-performance Fabric Mesh| Tempered Glass| Dual System/PSU Support| Massive Storage| Digital-RGB Lighting| Black, 189, https://www.newegg.com/black-phanteks-enthoo-pro-2-atx-full-tower/p/N82E16811854098?Description=MotherBoard&cm_re=MotherBoard-_-11-854-098-_-Product
MSI, MEG Z490 GODLIKE LGA 1200 Intel Z490 SATA 6Gb/s Extended ATX Intel Motherboard, 578, https://www.newegg.com/p/N82E16813144297?Description=MotherBoard&cm_re=MotherBoard-_-13-144-297-_-Product
ASUS, ROG Maximus XIII Extreme Glacial LGA 1200 Intel Z590 SATA 6Gb/s Extended ATX Intel Motherboard, 1387, https://www.newegg.com/asus-rog-maximus-xiii-extreme-glacial/p/N82E16813119415?Description=MotherBoard&cm_re=MotherBoard-_-13-119-415-_-Product
Lenovo, Ideacentre 700-25 INtel Desktop Motherboard s115X 01AJ143, 139, https://www.newegg.com/p/1HD-001N-002Z1?Description=MotherBoard&cm_re=MotherBoard-_-9SIAH8WCMU3592-_-Product
B75M, Desktop Motherboard B75 LGA 1155 for i3 i5 i7 CPU Support DDR33 Memory 3*USB 3.0 SATA 3.0 Up to 16GB, 94, https://www.newegg.com/p/1JW-00N7-00009?Description=MotherBoard&cm_re=MotherBoard-_-9SIB601GT07816-_-Product
G.SKILL, Trident Z Neo (For AMD Ryzen) Series 32GB (2 x 16GB) 288-Pin RGB DDR4 SDRAM DDR4 3600 (PC4 28800) Desktop Memory Model F4-3600C16D-32GTZNC, 184, https://www.newegg.com/g-skill-32gb-288-pin-ddr4-sdram/p/N82E16820232861?Description=MotherBoard&cm_re=MotherBoard-_-20-232-861-_-Product
NZXT, H510 - Compact ATX Mid-Tower PC Gaming Case - Front I/O USB Type-C Port - Tempered Glass Side Panel - Cable Management System - Water-Cooling Ready - Steel Construction - Black| CA-H510B-B1, 89, https://www.newegg.com/matte-black-nzxt-h-series-h510-atx-mid-tower/p/N82E16811146315?Description=MotherBoard&cm_re=MotherBoard-_-11-146-315-_-Product
1PC, Motherboard DDR4 ATX Type PCI-E M.2 For Intel Z390 MSI MPG 
 GAMING PRO CARBON Motherboard 1151 DDR4, 218, https://www.newegg.com/p/1JW-00NA-00004?Description=MotherBoard&cm_re=MotherBoard-_-9SIB26TGPR5060-_-Product
CORSAIR, Vengeance LPX 16GB (2 x 8GB) 288-Pin DDR4 SDRAM DDR4 3600 (PC4 28800) Intel XMP 2.0 Desktop Memory Model CMK16GX4M2D3600C16, 74, https://www.newegg.com/corsair-16gb-288-pin-ddr4-sdram/p/N82E16820236694?Description=MotherBoard&cm_re=MotherBoard-_-20-236-694-_-Product
CORSAIR, Vengeance RGB Pro 32GB (2 x 16GB) 288-Pin DDR4 SDRAM DDR4 2666 (PC4 21300) Desktop Memory Model CMW32GX4M2A2666C16W, 135, https://www.newegg.com/corsair-32gb-288-pin-ddr4-sdram/p/N82E16820236451?Description=MotherBoard&cm_re=MotherBoard-_-20-236-451-_-Product
Fractal, Design Define 7 XL Black Brushed Aluminum / Steel E-ATX Silent Modular Tempered Glass Window Full Tower Computer Case, 234, https://www.newegg.com/black-fractal-design-define-7-xl-atx-full-tower/p/N82E16811352119?Description=MotherBoard&cm_re=MotherBoard-_-11-352-119-_-Product
GIGABYTE, GA-970A-D3P AM3+/AM3 AMD 970 6 x SATA 6Gb/s USB 3.0 ATX AMD Motherboard Certified Refurbished, 87, https://www.newegg.com/gigabyte-ga-970a-d3p/p/N82E16813128825?Description=MotherBoard&cm_re=MotherBoard-_-13-128-825-_-Product
ASUS, ROG Strix X470-F Gaming AM4 AMD X470 SATA 6Gb/s ATX AMD Motherboard, NA, https://www.newegg.com/asus-rog-strix-x470-f-gaming/p/N82E16813119099?Description=MotherBoard&cm_re=MotherBoard-_-13-119-099-_-Product
ASRock, B560M-HDV LGA 1200 Intel B560 SATA 6Gb/s Micro ATX Intel Motherboard, 109, https://www.newegg.com/p/N82E16813157980?Description=MotherBoard&cm_re=MotherBoard-_-13-157-980-_-Product
Dual, Socket Motherboard E5CPU LGA 2011 3 Pin 8x DDR4 DIMM USB SATA M.2 PCI-E FEO, 135, https://www.newegg.com/p/1JW-00FR-00006?Description=MotherBoard&cm_re=MotherBoard-_-9SIAPREDEV6872-_-Product
ASUS, ROG Strix X399-E Gaming sTR4 AMD X399 SATA 6Gb/s USB 3.1 Extended ATX AMD Motherboard, 647, https://www.newegg.com/asus-rog-strix-x399-e-gaming/p/N82E16813119026?Description=MotherBoard&cm_re=MotherBoard-_-13-119-026-_-Product
Biostar, Tb360-Btc Pro Atx 32G 12 X Pci-E 3.0 Usb 3.1 Intel Btc Mine Board For Cryptocurrency Mining (Btc)|Support 12 Gpu Mining Motherboard, 271, https://www.newegg.com/p/1JW-00KJ-00002?Description=MotherBoard&cm_re=MotherBoard-_-1JW-00KJ-00002-_-Product
ASUS, TUF B450-Pro Gaming AM4 AMD B450 SATA 6Gb/s ATX AMD Motherboard, 148, https://www.newegg.com/asus-tuf-b450-pro-gaming/p/N82E16813119205?Description=MotherBoard&cm_re=MotherBoard-_-13-119-205-_-Product
GIGABYTE, B365M DS3H WIFI-Y1X-R LGA 1151 (300 Series) Intel B365 SATA 6Gb/s Micro ATX Intel Motherboard, 54, https://www.newegg.com/p/N82E16813145387?Description=MotherBoard&cm_re=MotherBoard-_-13-145-387-_-Product
BIOSTAR, TB250-BTC LGA 1151 Intel B250 SATA 6Gb/s USB 3.0 ATX Motherboard for Cryptocurrency Mining (BTC), 155, https://www.newegg.com/p/N82E16813138449?Description=MotherBoard&cm_re=MotherBoard-_-13-138-449-_-Product
GIGABYTE, X570 AORUS ULTRA AMD Ryzen 3000 PCIe 4.0 SATA 6Gb/s USB 3.2 AMD X570 ATX Motherboard, 443, https://www.newegg.com/gigabyte-x570-aorus-ultra/p/N82E16813145156?Description=MotherBoard&cm_re=MotherBoard-_-13-145-156-_-Product
GIGABYTE, GA-Z97-D3H LGA 1150 Intel Z97 HDMI SATA 6Gb/s USB 3.0 ATX Intel Motherboard, NA, https://www.newegg.com/p/N82E16813128713?Description=MotherBoard&cm_re=MotherBoard-_-13-128-713-_-Product
ASUS, TUF GAMING X570-PLUS WI-FI AMD Socket X570 AM4 ATX M.2 Desktop Motherboard A, 119, https://www.newegg.com/asus-tuf-gaming-x570-plus-wi-fi/p/2MG-000B-00376?Description=MotherBoard&cm_re=MotherBoard-_-2MG-000B-00376-_-Product
Intel, Core i5-10400 - Core i5 10th Gen Comet Lake 6-Core 2.9 GHz LGA 1200 65W Intel UHD Graphics 630 Desktop Processor - BX8070110400, 141, https://www.newegg.com/intel-core-i5-10400-core-i5-10th-gen/p/N82E16819118135?Description=MotherBoard&cm_re=MotherBoard-_-19-118-135-_-Product
