Marca,Desc_Producto,Precio,URL_Producto
G.SKILL, Aegis 8GB 288-Pin DDR4 SDRAM DDR4 2400 (PC4 19200) Intel Z170 Platform / Intel X99 Platform Desktop Memory Model F4-2400C15S-8GIS, 29, https://www.newegg.com/g-skill-8gb-288-pin-ddr4-sdram/p/N82E16820232257?Description=MotherBoard&cm_re=MotherBoard-_-20-232-257-_-Product
GIGABYTE, C246N-WU2 LGA 1151 (300 Series) Intel C246 SATA 6Gb/s Mini ITX Intel Motherboard, 354, https://www.newegg.com/p/N82E16813145177?Description=MotherBoard&cm_re=MotherBoard-_-13-145-177-_-Product
ASUS, A58M-K FM2+ AMD A58 (Bolton D2) Micro ATX AMD Motherboard, 99, https://www.newegg.com/asus-a58m-k/p/N82E16813132137?Description=MotherBoard&cm_re=MotherBoard-_-9SIAME0G9K0772-_-Product
Intel, BOXD915GUXLK LGA 775 Intel 915G Micro ATX Intel Motherboard, 179, https://www.newegg.com/p/N82E16813121252?Description=MotherBoard&cm_re=MotherBoard-_-13-121-252-_-Product
Fractal, Design Torrent Gray E-ATX Tempered Glass Window High-Airflow Mid Tower Computer Case FD-C-TOR1A-02, 189, https://www.newegg.com/gray-fractal-design-torrent-atx-mid-tower/p/N82E16811352144?Description=MotherBoard&cm_re=MotherBoard-_-11-352-144-_-Product
ASUS, ROG Strix Z390-I Gaming Motherboard LGA1151 (Intel 8th and 9th Gen) Mini ITX (mITX) DDR4 DP HDMI M.2 USB 3.1 Gen2 Onboard 802.11 ac Wi-Fi, 498, https://www.newegg.com/asus-rog-strix-z390-i-gaming/p/1JW-000C-00U35?Description=MotherBoard&cm_re=MotherBoard-_-1JW-000C-00U35-_-Product
GIGABYTE, GA-H55M-UD2H LGA 1156 Intel H55 HDMI Micro ATX Intel Motherboard, NA, https://www.newegg.com/p/N82E16813128421?Description=MotherBoard&cm_re=MotherBoard-_-13-128-421-_-Product
Gigabyte, B450M AORUS ELITE AM4 Micro-ATX Motherboard, 99, https://www.newegg.com/gigabyte-b450m-aorus-elite/p/2MG-000K-000T2?Description=MotherBoard&cm_re=MotherBoard-_-2MG-000K-000T2-_-Product
ASUS, TUF GAMING B460M-PLUS WIFI Intel B460 1200 LGA MicroATX Desktop Motherboard, 89, https://www.newegg.com/asus-tuf-gaming-b460m-plus-wi-fi/p/1JW-000C-00Z25?Description=MotherBoard&cm_re=MotherBoard-_-1JW-000C-00Z25-_-Product
ASRock, H71M-DG3 Motherboard LGA 1155 Micro ATX Intel DDR3 With i/O Shield, 79, https://www.newegg.com/p/1HD-004K-000D5?Description=MotherBoard&cm_re=MotherBoard-_-1HD-004K-000D5-_-Product
DCA20, LA-E883P Lenovo Ideacentre 520-24AST Series AMD A12-9720P AIO Desktop Motherboard 01LM214 All-In-One Desktop Motherboards, 60, https://www.newegg.com/p/2MG-0014-00023?Description=MotherBoard&cm_re=MotherBoard-_-9SIACTN8GU4195-_-Product
AX2, HP CQ42 G42 CQ62 G62 Series AMD Socket S1 Radeon HD 6370M Motherboard 632186-001 Laptop Motherboards, 55, https://www.newegg.com/p/2MG-000H-002N1?Description=MotherBoard&cm_re=MotherBoard-_-9SIACTNEGV6649-_-Product
GIGABYTE, GA-H270-HD3 (rev. 1.0) LGA 1151 Intel H270 HDMI SATA 6Gb/s USB 3.1 ATX Motherboards - Intel, NA, https://www.newegg.com/p/N82E16813128976?Description=MotherBoard&cm_re=MotherBoard-_-13-128-976-_-Product
MSI, PRO Z690-A DDR4 LGA 1700 Intel Z690 SATA 6Gb/s ATX Intel Motherboard, 199, https://www.newegg.com/p/N82E16813144489
ASUS, ROG Strix Z690-F Gaming WiFi 6E LGA 1700 Intel 12th Gen ATX Gaming Motherboard- PCIe 5.0| DDR5| 16+1 Power Stages| 2.5 Gb LAN| Bluetooth v5.2| Thunderbolt 4| 4xM.2/NVMe SSD, 399, https://www.newegg.com/asus-rog-strix-z690-f-gaming-wifi/p/N82E16813119503
GIGABYTE, B660 GAMING X AX DDR4 B660 Intel LGA 1700 ATX Motherboard with DDR4| Triple M.2| PCIe 4.0| USB 3.2 Gen2 Type-C| WiFi 6E 802.11ax| 2.5GbE LAN, 169, https://www.newegg.com/p/N82E16813145381
ASUS, ROG STRIX Z590-E GAMING WIFI LGA 1200 ATX Intel Motherboard, 269, https://www.newegg.com/asus-rog-strix-z590-e-gaming-wifi/p/N82E16813119367
silverstone, technology gd09b home theater computer case (htpc) with faux aluminum design for atx/micro-atx motherboards gd09b-x, 175, https://www.newegg.com/p/2AM-006F-00121?Description=MotherBoard&cm_re=MotherBoard-_-2AM-006F-00121-_-Product
ASUS, H61M-CS LGA1155 DDR3 Intel H61 SATA3 USB2.0 Micro ATX Intel Motherboard, 54, https://www.newegg.com/p/1JW-000C-00W49?Description=MotherBoard&cm_re=MotherBoard-_-9SIAME0DKY1849-_-Product
MSI, B360-A PRO LGA 1151 (300 Series) Intel B360 SATA 6Gb/s USB 3.1 ATX Intel Motherboard, NA, https://www.newegg.com/p/N82E16813144155?Description=MotherBoard&cm_re=MotherBoard-_-13-144-155-_-Product
MSI, Z170-A PRO LGA 1151 Intel Z170 SATA 6Gb/s USB 3.1 ATX Intel Motherboard, NA, https://www.newegg.com/p/N82E16813130892?Description=MotherBoard&cm_re=MotherBoard-_-13-130-892-_-Product
ASUS, PRIME B560M-A AC-SI Intel B560 Intel Motherboard, 118, https://www.newegg.com/p/N82E16813119466R?Description=MotherBoard&cm_re=MotherBoard-_-13-119-466R-_-Product
Fractal, Design Meshify 2 Compact Black ATX Flexible High-Airflow Mid Tower Computer Case| FD-C-MES2C-01, 124, https://www.newegg.com/black-fractal-design-meshify-2-compact-atx-mid-tower/p/N82E16811352138?Description=MotherBoard&cm_re=MotherBoard-_-11-352-138-_-Product
CORSAIR, Vengeance RGB Pro SL 64GB (4 x 16GB) 288-Pin DDR4 SDRAM DDR4 3600 (PC4 28800) Intel XMP 2.0 Desktop Memory Model CMH64GX4M4D3600C18, 299, https://www.newegg.com/corsair-64gb-288-pin-ddr4-sdram/p/N82E16820236741?Description=MotherBoard&cm_re=MotherBoard-_-20-236-741-_-Product
MSI, PRO Z270 PC MATE LGA 1151 Intel Z270 HDMI SATA 6Gb/s USB 3.1 ATX Intel Motherboard, 116, https://www.newegg.com/msi-pro-z270-pc-mate/p/N82E16813144123?Description=MotherBoard&cm_re=MotherBoard-_-13-144-123-_-Product
ASUS, TUF SABERTOOTH Z170 S LGA 1151 Intel Z170 HDMI SATA 6Gb/s USB 3.1 USB 3.0 ATX Intel Motherboard, 282, https://www.newegg.com/asus-tuf-sabertooth-z170-s/p/N82E16813132715?Description=MotherBoard&cm_re=MotherBoard-_-13-132-715-_-Product
ASUS, ROG STRIX B550-F GAMING (90MB14S0-M0EAY0) AM4 AMD B550 SATA 6Gb/s ATX AMD Motherboard, 193, https://www.newegg.com/asus-rog-strix-b550-f-gaming/p/N82E16813119464?Description=MotherBoard&cm_re=MotherBoard-_-9SIB7RAHFR0814-_-Product
GIGABYTE, GA-970A-DS3 AM3+ AMD 970 + SB950 SATA 6Gb/s USB 3.0 ATX AMD Motherboard, NA, https://www.newegg.com/gigabyte-ga-970a-ds3/p/N82E16813128553?Description=MotherBoard&cm_re=MotherBoard-_-13-128-553-_-Product
ASUS, Z77-A LGA 1155 Intel Z77 HDMI SATA 6Gb/s USB 3.0 ATX Intel Motherboard, 105, https://www.newegg.com/p/N82E16813132094?Description=MotherBoard&cm_re=MotherBoard-_-13-132-094-_-Product
MSI, X570-A PRO Motherboard AMD AM4 SATA 6Gb/s M.2 USB 3.2 Gen 2 HDMI ATX, 208, https://www.newegg.com/p/2MG-000M-00381?Description=MotherBoard&cm_re=MotherBoard-_-2MG-000M-00381-_-Product
partscollection, cpu fan for hp pavilion 400-224 / 400-214 slimline mulberry amd a4-5000 motherboard, 19, https://www.newegg.com/p/1FR-000M-009U4?Description=MotherBoard&cm_re=MotherBoard-_-1FR-000M-009U4-_-Product
GIGABYTE, GA-Z270-HD3 (rev. 1.0) LGA 1151 Intel Z270 HDMI SATA 6Gb/s USB 3.1 ATX Motherboards - Intel, 119, https://www.newegg.com/p/N82E16813128974?Description=MotherBoard&cm_re=MotherBoard-_-13-128-974-_-Product
ASUS, PRIME B450M-K AM4 AMD B450 SATA 6Gb/s USB 3.1 Micro ATX AMD Motherboard, 129, https://www.newegg.com/asus-prime-b450m-k/p/2MG-000B-004E5?Description=MotherBoard&cm_re=MotherBoard-_-9SIAT8UHE58535-_-Product
MSI, PERFORMANCE GAMING B450 GAMING PLUS AM4 AMD B450 SATA 6Gb/s USB 3.1 HDMI ATX AMD Motherboard, NA, https://www.newegg.com/msi-performance-gaming-b450-gaming-plus/p/N82E16813144191?Description=MotherBoard&cm_re=MotherBoard-_-13-144-191-_-Product
ASUS, MAXIMUS VI IMPACT LGA 1150 Intel Z87 HDMI SATA 6Gb/s USB 3.0 Mini ITX Intel Motherboard, 197, https://www.newegg.com/p/N82E16813132176?Description=MotherBoard&cm_re=MotherBoard-_-13-132-176-_-Product
BTC-S37, Mining Motherboard CPU Set 8 Video Card Slot DDR3 Support 1066/1333/1600MHz (65mm Interval), 209, https://www.newegg.com/jingsha-model-btc-s37/p/1HD-00E3-00004?Description=MotherBoard&cm_re=MotherBoard-_-9SIATXZE5N0202-_-Product
ASUS, M2A-MX AM2/AM2+ DDR2 Micro ATX AMD Motherboard, 48, https://www.newegg.com/asus-m2a-mx/p/2MG-000B-003E4?Description=MotherBoard&cm_re=MotherBoard-_-9SIAME0DEV6285-_-Product
ASUS, B550M-PLUS WIFI-GMZR Desktop Computer Demon Slayer Kamado Nezuko Motherboard, 182, https://www.newegg.com/asus-tuf-gaming-b550m-plus-wifi/p/2MG-000B-004B1?Description=MotherBoard&cm_re=MotherBoard-_-2MG-000B-004B1-_-Product
GIGABYTE, Z370 AORUS GAMING WIFI (rev. 1.0) LGA 1151 (300 Series) Intel Z370 HDMI SATA 6Gb/s USB 3.1 ATX Intel Motherboard, 294, https://www.newegg.com/p/N82E16813145043?Description=MotherBoard&cm_re=MotherBoard-_-13-145-043-_-Product
Corsair, Crystal Series 280X RGB CC-9011137-WW White Steel / Plastic / Tempered Glass Micro-ATX Case Computer Case, 159, https://www.newegg.com/white-corsair-crystal-series-280x-rgb-micro-atx-case/p/N82E16811139130?Description=MotherBoard&cm_re=MotherBoard-_-11-139-130-_-Product
MSI, B450 TOMAHAWK MAX II Gaming Motherboard (AMD Ryzen 3000 3rd gen ryzen AM4| DDR4| M.2| USB 3.2 Gen 1| HDMI| ATX) (7C02-014R), 149, https://www.newegg.com/p/2MG-000M-003M8?Description=MotherBoard&cm_re=MotherBoard-_-9SIAKVHH1F9796-_-Product
H81-1150, Computer 100mb Ethernet Mainboard Motherboard Support LGA 1150, 71, https://www.newegg.com/p/1JW-003E-00036?Description=MotherBoard&cm_re=MotherBoard-_-9SIAWY5FS93056-_-Product
G.SKILL, Aegis 16GB 288-Pin DDR4 SDRAM DDR4 2133 (PC4 17000) Desktop Memory Model F4-2133C15S-16GIS, 52, https://www.newegg.com/g-skill-16gb-288-pin-ddr4-sdram/p/N82E16820232249?Description=MotherBoard&cm_re=MotherBoard-_-20-232-249-_-Product
MSI, Z590-A PRO LGA 1200 Intel Z590 SATA 6Gb/s ATX Intel Motherboard, 132, https://www.newegg.com/p/N82E16813144498?Description=MotherBoard&cm_re=MotherBoard-_-13-144-498-_-Product
Yosoo, WiFi Mainboard| PCB MCU Circuit Module Board Replacement Motherboard Main Board for Playstation PS Vita 1000, 365, https://www.newegg.com/p/2MG-006C-00002?Description=MotherBoard&cm_re=MotherBoard-_-9SIA93AJ197170-_-Product
ASUS, PRIME H370M-PLUS/CSM Intel LGA 1151 H370 MicroATX Desktop Motherboard B, 154, https://www.newegg.com/p/1JW-000C-00EZ9?Description=MotherBoard&cm_re=MotherBoard-_-1JW-000C-00EZ9-_-Product
Fractal, Design Torrent Nano White TG Clear Tint Tempered Glass High-Airflow Mini-ITX Computer Case, 119, https://www.newegg.com/white-fractal-design-torrent-nano-mini-itx-tower/p/N82E16811352155?Description=MotherBoard&cm_re=MotherBoard-_-11-352-155-_-Product
SilverStone, Sugo Series SG12 SST-SG12B-V2 Black Refinement of Classic Small Form Factor Case, 164, https://www.newegg.com/black-silverstone-sugo-series-micro-atx/p/N82E16811163402?Description=MotherBoard&cm_re=MotherBoard-_-9SIA62V9CA8340-_-Product
ASUS, PRIME B550M-A AC AM4 AMD B550 SATA 6Gb/s Micro ATX AMD Motherboard, 110, https://www.newegg.com/asus-prime-b550m-a-ac/p/N82E16813119492R?Description=MotherBoard&cm_re=MotherBoard-_-13-119-492R-_-Product
CORSAIR, Vengeance LPX 32GB (2 x 16GB) 288-Pin DDR4 SDRAM DDR4 3200 (PC4 25600) Intel XMP 2.0 Desktop Memory Model CMK32GX4M2E3200C16W, 132, https://www.newegg.com/corsair-32gb-288-pin-ddr4-sdram/p/N82E16820236737?Description=MotherBoard&cm_re=MotherBoard-_-20-236-737-_-Product
New, INLAND Professional 256GB NVMe M.2 2280 SSD + AMD Ryzen 7 5700G Desktop Processor with ASUS ROG Strix B550-F Gaming (WI-FI) PCIe 4.0 ATX Gaming Motherboard Bundle, 768, https://www.newegg.com/p/2MG-000B-004B6?Description=MotherBoard&cm_re=MotherBoard-_-9SIAH9BH9V1325-_-Product
Cougar, MX330 Mid Tower Case with Full Acrylic Transparent Window and USB 3.0, 49, https://www.newegg.com/p/N82E16811553031?Description=MotherBoard&cm_re=MotherBoard-_-11-553-031-_-Product
GIGABYTE, GA-Z97-D3H --- LGA 1150 Intel Z97 HDMI SATA 6Gb/s USB 3.0 ATX Intel Motherboard, 105, https://www.newegg.com/gigabyte-comes-with-motherboard-and-io-shield-100-tested-well-before-shipping-please-take-the-vid/p/1JW-000J-00049?Description=MotherBoard&cm_re=MotherBoard-_-1JW-000J-00049-_-Product
ASUS, TUF Gaming Z690-Plus WiFi D4 LGA 1700 Intel 12th Gen ATX Gaming Motherboard- PCIe 5.0| DDR4| 4xM.2/NVMe SSD| 14+2 Power Stages| WiFi 6| Intel 2.5Gb LAN, 289, https://www.newegg.com/asus-tuf-gaming-z690-plus-wifi-d4/p/N82E16813119506
MSI, MPG Z690 EDGE WIFI DDR4 LGA 1700 ATX Intel Motherboard, 319, https://www.newegg.com/p/N82E16813144486
ASRock, Z690M-ITX/ax LGA 1700 DDR4 Mini ITX Intel Motherboard, 229, https://www.newegg.com/p/N82E16813162033
ASUS, ROG STRIX B660-I GAMING WIFI LGA 1700 (Intel 12th Gen) Mini-ITX Gaming Motherboard (PCIe 5.0| 8+1 power stages| DDR5| WiFi 6| 2.5 Gb LAN| 2xM.2 PCIe 4.0 NVMe SSD support| USB 3.2 Gen 2x2 Type-C), 219, https://www.newegg.com/asus-rog-strix-b660-i-gaming-wifi/p/N82E16813119539
GIGABYTE, GA-Z97-D3H --- LGA 1150 Intel Z97 HDMI SATA 6Gb/s USB 3.0 ATX Intel Motherboard, 105, https://www.newegg.com/gigabyte-comes-with-motherboard-and-io-shield-100-tested-well-before-shipping-please-take-the-vid/p/1JW-000J-00049?Description=MotherBoard&cm_re=MotherBoard-_-1JW-000J-00049-_-Product
GIGABYTE, GA-F2A55M-DS2 FM2 AMD A55 (Hudson D2) Micro ATX AMD Motherboard with UEFI BIOS, NA, https://www.newegg.com/gigabyte-ga-f2a55m-ds2/p/N82E16813128578?Description=MotherBoard&cm_re=MotherBoard-_-13-128-578-_-Product
Fractal, Design Torrent Compact FD-C-TOR1C-03 White Steel / Tempered Glass ATX Mid Tower Computer Case ATX Power Supply, 149, https://www.newegg.com/white-fractal-design-torrent-compact-atx-mid-tower/p/N82E16811352151?Description=MotherBoard&cm_re=MotherBoard-_-11-352-151-_-Product
ASRock, X399 Taichi sTR4 AMD X399 SATA 6Gb/s ATX AMD Motherboard, 594, https://www.newegg.com/p/2MG-0001-000E3?Description=MotherBoard&cm_re=MotherBoard-_-9SIAKRFH0G8884-_-Product
ASUS, Intel WS C422 PRO/SE Socket LGA 2066 DDR4 ATX Motherboard (90SW0080-M0EAY0), 498, https://www.newegg.com/p/1JW-000C-007A5?Description=MotherBoard&cm_re=MotherBoard-_-9SIA25VC470307-_-Product
MSI, Z97-Gaming 3 LGA 1150 Intel Z97 HDMI SATA 6Gb/s USB 3.0 ATX Intel Motherboard, NA, https://www.newegg.com/p/N82E16813130772?Description=MotherBoard&cm_re=MotherBoard-_-13-130-772-_-Product
GIGABYTE, Z690M AORUS ELITE DDR4 Micro-ATX Motherboard, 327, https://www.newegg.com/p/1JW-000J-00444?Description=MotherBoard&cm_re=MotherBoard-_-1JW-000J-00444-_-Product
G3BB, N17E HP Omen 17-AN 17T-AN Core I5-7300HQ CPU GTX1060 6GB GDDR5 Motherboard 937746-001 Laptop Motherboards, 380, https://www.newegg.com/p/1JW-000M-01F53?Description=MotherBoard&cm_re=MotherBoard-_-9SIACTNETN2519-_-Product
ASUS, H61M-K LGA 1155 Intel H61 (B3) uATX Intel Motherboard, 143, https://www.newegg.com/p/N82E16813132504?Description=MotherBoard&cm_re=MotherBoard-_-13-132-504-_-Product
GIGABYTE, G1 Gaming GA-Z97X-Gaming 3 --- LGA 1150 Intel Z97 HDMI SATA 6Gb/s USB 3.0 ATX Intel Motherboard, 116, https://www.newegg.com/gigabyte-g1-gaming-ga-z97x-gaming-3/p/1JW-000J-00048?Description=MotherBoard&cm_re=MotherBoard-_-1JW-000J-00048-_-Product
CORSAIR, Vengeance RGB Pro 256GB (8 x 32GB) 288-Pin DDR4 SDRAM DDR4 3200 (PC4 25600) Desktop Memory Model CMW256GX4M8E3200C16W, 1279, https://www.newegg.com/corsair-256gb-288-pin-ddr4-sdram/p/N82E16820236604?Description=MotherBoard&cm_re=MotherBoard-_-20-236-604-_-Product
450725-003, HP DC5850 461537-001 AM2 AMD Motherboard AMD SOCKET AM2+ AM3 Motherboards, 52, https://www.newegg.com/p/2MG-000H-000C5?Description=MotherBoard&cm_re=MotherBoard-_-9SIAJ5VAWF7896-_-Product
GIGABYTE, B460 HD3 LGA 1200 Intel B460 ATX Motherboard with Dual M.2| SATA 6Gb/s| USB 3.2 Gen 1, 101, https://www.newegg.com/p/N82E16813145209R?Description=MotherBoard&cm_re=MotherBoard-_-13-145-209R-_-Product
GIGABYTE, GA-B85M-D3H LGA 1150 Intel B85 HDMI SATA 6Gb/s USB 3.0 Micro ATX Intel Motherboard, NA, https://www.newegg.com/p/N82E16813128607?Description=MotherBoard&cm_re=MotherBoard-_-13-128-607-_-Product
11013301, lenovo k330b intel desktop motherboard s1155, 142, https://www.newegg.com/p/1HD-001N-003M0?Description=MotherBoard&cm_re=MotherBoard-_-1HD-001N-003M0-_-Product
MSI, ARSENAL GAMING B360M BAZOOKA LGA 1151 (300 Series) Intel B360 HDMI SATA 6Gb/s USB 3.1 Micro ATX Intel Motherboard, 100, https://www.newegg.com/msi-arsenal-gaming-b360m-bazooka/p/N82E16813144228?Description=MotherBoard&cm_re=MotherBoard-_-13-144-228-_-Product
ASUS, ROG Rampage VI Extreme Encore LGA 2066 Intel X299 SATA 6Gb/s Extended ATX Intel Motherboard, 1191, https://www.newegg.com/p/1JW-000C-00ZF7?Description=MotherBoard&cm_re=MotherBoard-_-1JW-000C-00ZF7-_-Product
GIGABYTE, GA-Z97X-UD3H (rev. 1.2) LGA 1150 Intel Z97 HDMI SATA 6Gb/s USB 3.0 ATX Intel Motherboard, NA, https://www.newegg.com/p/N82E16813128710?Description=MotherBoard&cm_re=MotherBoard-_-13-128-710-_-Product
BAL22, LA-D803P Dell Inspiron 17 5765 15 5565 Series AMD A12-9700P CPU Laptop Motherboard N7GMF Laptop Motherboards, 74, https://www.newegg.com/p/2MG-000G-001K0?Description=MotherBoard&cm_re=MotherBoard-_-9SIACTND3V6502-_-Product
MSI, 970A GAMING PRO CARBON AM3+/AM3 AMD 970 & SB950 SATA 6Gb/s USB 3.1 ATX Motherboards - AMD, 398, https://www.newegg.com/msi-970a-gaming-pro-carbon/p/N82E16813130951?Description=MotherBoard&cm_re=MotherBoard-_-13-130-951-_-Product
MSI, LGA 1151 300 Series Intel Z370 HDMI SATA 6Gb/s USB 3.1 Micro ATX Intel Motherboard Model Z370M MORTAR, 154, https://www.newegg.com/p/1JW-001M-002E9?Description=MotherBoard&cm_re=MotherBoard-_-1JW-001M-002E9-_-Product
ASUS, P8Z77-V LX LGA 1155 Intel Z77 HDMI SATA 6Gb/s USB 3.0 ATX Intel Motherboard, 95, https://www.newegg.com/p/N82E16813131962?Description=MotherBoard&cm_re=MotherBoard-_-13-131-962-_-Product
MSI, 990FXA-GD80 V2 AM3+ AMD 990FX + SB950 SATA 6Gb/s USB 3.0 ATX AMD Motherboard, 259, https://www.newegg.com/msi-990fxa-gd80-v2/p/N82E16813130649?Description=MotherBoard&cm_re=MotherBoard-_-13-130-649-_-Product
ASUS, TUF Z370-Pro Gaming LGA 1151 (300 Series) Intel Z370 HDMI SATA 6Gb/s USB 3.1 ATX Intel Motherboard, NA, https://www.newegg.com/asus-tuf-z370-pro-gaming/p/N82E16813119041?Description=MotherBoard&cm_re=MotherBoard-_-13-119-041-_-Product
ASUS, PRO Q470M-C/CSM LGA 1200 Intel Q470 SATA 6Gb/s Micro ATX Intel Motherboard, 205, https://www.newegg.com/p/N82E16813119302?Description=MotherBoard&cm_re=MotherBoard-_-13-119-302-_-Product
ATX, Mid Tower Gaming Computer Case 3 ARGB Fans Tempered Glass Side Window USB 3.0 Port| Mesh Airflow with Polygonal Mesh Front Panel| Gaming Style Window Case| White, 69, https://www.newegg.com/p/2AM-0323-00027?Description=MotherBoard&cm_re=MotherBoard-_-9SIAP6DEW83653-_-Product
GIGABYTE, C621 AORUS XTREME LGA 3647 Intel C621 SATA 6Gb/s Extended ATX Intel Motherboard, 2183, https://www.newegg.com/p/N82E16813145153?Description=MotherBoard&cm_re=MotherBoard-_-13-145-153-_-Product
Motherboard, X99 chipset mainboard lga 2011-3 mother board support Intel Xeon E5-2678v3 / 2669v3 / 2649v3 / 2629v3, 1366, https://www.newegg.com/p/375-01N8-00AN1?Description=MotherBoard&cm_re=MotherBoard-_-375-01N8-00AN1-_-Product
ASUS, Z97M-PLUS LGA 1150 Intel Z97 HDMI SATA 6Gb/s USB 3.0 Micro ATX Intel Motherboard, NA, https://www.newegg.com/p/N82E16813132130?Description=MotherBoard&cm_re=MotherBoard-_-13-132-130-_-Product
Metallic, Gear Neo Air White ATX Mid-tower High Airflow Mesh front design| 2x 120 RGB Skiron fans| RGB Controller| Black/White, 89, https://www.newegg.com/black-white-metallic-gear-neo-air-atx-mid-tower/p/N82E16811854093?Description=MotherBoard&cm_re=MotherBoard-_-11-854-093-_-Product
ASUS, Pro WS WRX80E-SAGE SE WIFI sWRX8 AMD WRX80 SATA 6Gb/s Extended ATX AMD Motherboard, 798, https://www.newegg.com/asus-pro-ws-wrx80e-sage-se-wifi/p/N82E16813119391R?Description=MotherBoard&cm_re=MotherBoard-_-13-119-391R-_-Product
Cooler, Master MasterBox TD500 Mesh White Airflow ATX Mid-Tower with Polygonal Mesh Front Panel| Crystalline Tempered Glass| E-ATX up to 10.5"| Three 120mm ARGB Lighting Fans, 134, https://www.newegg.com/white-gray-cooler-master-masterbox-td500-mesh-white-atx-mid-tower/p/N82E16811119394?Description=MotherBoard&cm_re=MotherBoard-_-11-119-394-_-Product
GIGABYTE, B450M AORUS ELITE AM4 Micro-ATX Motherboard, 133, https://www.newegg.com/p/2MG-000K-00134?Description=MotherBoard&cm_re=MotherBoard-_-2MG-000K-00134-_-Product
Asus, ROG Strix Z390-E Gaming Motherboard LGA1151 (Intel 8th 9th Gen) ATX DDR4 DP HDMI M.2 USB 3.1 Gen2 802.11AC Wi-Fi, 199, https://www.newegg.com/p/1JW-000C-00VM1?Description=MotherBoard&cm_re=MotherBoard-_-1JW-000C-00VM1-_-Product
MSI, Z97S SLI Krait Edition LGA 1150 Intel Z97 HDMI SATA 6Gb/s USB 3.0 ATX Intel Motherboard, NA, https://www.newegg.com/p/N82E16813130801?Description=MotherBoard&cm_re=MotherBoard-_-13-130-801-_-Product
CORSAIR, Vengeance LPX 16GB (2 x 8GB) 288-Pin DDR4 SDRAM DDR4 3000 (PC4 24000) Intel XMP 2.0 Memory Kit Model CMK16GX4M2B3000C15, 71, https://www.newegg.com/corsair-16gb-288-pin-ddr4-sdram/p/N82E16820233852?Description=MotherBoard&cm_re=MotherBoard-_-20-233-852-_-Product
ASUS, PRIME B550-PLUS AM4 ATX AMD Motherboard, 135, https://www.newegg.com/asus-prime-b550-plus/p/N82E16813119323
MSI, MPG Z590 GAMING FORCE LGA 1200 ATX Intel Motherboard, 217, https://www.newegg.com/p/N82E16813144386
GIGABYTE, X570 AORUS ELITE WIFI AM4 ATX AMD Motherboard, 179, https://www.newegg.com/gigabyte-x570-aorus-elite-wifi/p/N82E16813145165
ASUS, Prime X570-P Ryzen 3 AM4 with PCIe Gen4| Dual M.2 HDMI| SATA 6Gb/s USB 3.2 Gen 2 ATX Motherboard, 152, https://www.newegg.com/asus-prime-x570-p/p/N82E16813119199
ASUS, TUF GAMING Z590-PLUS LGA 1200 Intel Z590 SATA 6Gb/s ATX Intel Motherboard, 170, https://www.newegg.com/p/N82E16813119374R?Description=MotherBoard&cm_re=MotherBoard-_-13-119-374R-_-Product
ASUS, B150 PRO GAMING D3 LGA 1151 Intel B150 HDMI SATA 6Gb/s USB 3.1 USB 3.0 ATX Intel Motherboard, NA, https://www.newegg.com/p/N82E16813132580?Description=MotherBoard&cm_re=MotherBoard-_-13-132-580-_-Product
ASUS, Z170-E LGA 1151 Intel Z170 HDMI SATA 6Gb/s USB 3.1 Intel Motherboard, 139, https://www.newegg.com/p/1JW-000C-001G3?Description=MotherBoard&cm_re=MotherBoard-_-1JW-000C-001G3-_-Product
SUPERMICRO, MBD-C7Z370-CG-IW-O LGA 1151 (300 Series) Intel Z370 HDMI SATA 6Gb/s Mini ITX Intel Motherboard, 279, https://www.newegg.com/p/N82E16813183637?Description=MotherBoard&cm_re=MotherBoard-_-13-183-637-_-Product
MetallicGear, NEO Qube| Dual Tempered Glass Design| Dual Chamber ATX Mid-Tower| Digital-RGB Lighting| Dual System Support| White, 129, https://www.newegg.com/white-metallic-gear-neo-qube-dual-chamber-atx-mid-tower/p/N82E16811700009?Description=MotherBoard&cm_re=MotherBoard-_-11-700-009-_-Product
MSI, PERFORMANCE GAMING X470 GAMING PRO CARBON AM4 AMD X470 SATA 6Gb/s USB 3.1 HDMI ATX AMD Motherboard, 312, https://www.newegg.com/msi-performance-gaming-x470-gaming-pro-carbon/p/N82E16813144178?Description=MotherBoard&cm_re=MotherBoard-_-13-144-178-_-Product
DeepCool, MACUBE 110 WH Micro ATX Case with Full-size Magnetic Tempered Glass Removable HDD Cage and Built-in Graphics Card Holder - White, 63, https://www.newegg.com/p/N82E16811853089?Description=MotherBoard&cm_re=MotherBoard-_-11-853-089-_-Product
DELL, POWEREDGE C1100 CLOUDEDGE C1100 INTEL DUAL LGA1366 SERVER MOTHERBOARD CX9M7, 59, https://www.newegg.com/p/1JW-000H-02033?Description=MotherBoard&cm_re=MotherBoard-_-9SIAKDZEEK2609-_-Product
ASUS, PRIME H270-PLUS/CSM LGA 1151 Intel H270 HDMI SATA 6Gb/s USB 3.1 ATX Motherboards - Intel, NA, https://www.newegg.com/p/N82E16813132942?Description=MotherBoard&cm_re=MotherBoard-_-13-132-942-_-Product
ASRock, Z97 EXTREME3 LGA 1150 Intel Z97 HDMI SATA 6Gb/s USB 3.1 ATX Intel Motherboard, 141, https://www.newegg.com/p/1JW-001Z-00197?Description=MotherBoard&cm_re=MotherBoard-_-1JW-001Z-00197-_-Product
ASUS, PRIME TRX40-PRO S sTRX4 AMD TRX40 SATA 6Gb/s ATX AMD Motherboard, 819, https://www.newegg.com/p/2MG-000B-00415?Description=MotherBoard&cm_re=MotherBoard-_-2MG-000B-00415-_-Product
Jetway, JNP691-3350 Pico-ITX Embedded Motherboard| Apollo Lake N3350| 1* GbLAN| 2* Serial Port| 4* USB| SIM Car Holder| 1* HDMI| 1* LVDS| 1* M.2 Slot| TPM 2.0, 249, https://www.newegg.com/p/1JW-001S-00029?Description=MotherBoard&cm_re=MotherBoard-_-9SIAB94B9P5060-_-Product
MSI, MAG A520M Vector WiFi Gaming Motherboard (AMD AM4| DDR4| PCIe 3.0| SATA 6Gb/s| 1* M.2| USB 3.2 Gen 1| HDMI/DP| WiFi 5| Micro-ATX) (A520VECTWIFI), 143, https://www.newegg.com/p/2MG-000M-003N2?Description=MotherBoard&cm_re=MotherBoard-_-2MG-000M-003N2-_-Product
ASUS, ROG Maximus XI Hero (Wi-Fi) Z390 Gaming Motherboard LGA1151 (Intel 8th and 9th Gen) ATX DDR4 DP HDMI M.2 USB 3.1 Gen2 Onboard 802.11 ac, 255, https://www.newegg.com/p/1JW-000C-00V72?Description=MotherBoard&cm_re=MotherBoard-_-1JW-000C-00V72-_-Product
MSI, X99A TOMAHAWK LGA 2011-v3 Intel X99 SATA 6Gb/s USB 3.1 ATX Motherboards - Intel, 245, https://www.newegg.com/p/N82E16813144067?Description=MotherBoard&cm_re=MotherBoard-_-13-144-067-_-Product
MSI, MPG Z390 Gaming Plus LGA1151 (Intel 8th and 9th Gen) M.2 USB 3.1 Gen 2 DDR4 HDMI DVI CFX ATX Z390 Gaming Motherboard (MPGZ390GAMINGPLUS), 596, https://www.newegg.com/p/2MG-000M-003H8?Description=MotherBoard&cm_re=MotherBoard-_-9SIAKVHH1F9753-_-Product
GIGABYTE, B450M GAMING AM4 AMD B450 SATA 6Gb/s USB 3.1 HDMI Micro ATX AMD Motherboard, 112, https://www.newegg.com/gigabyte-b450m-gaming/p/N82E16813145135?Description=MotherBoard&cm_re=MotherBoard-_-13-145-135-_-Product
GIGABYTE, GA-EX58-UD3R LGA 1366 Intel X58 ATX Intel Motherboard, NA, https://www.newegg.com/p/N82E16813128375?Description=MotherBoard&cm_re=MotherBoard-_-13-128-375-_-Product
HUANANZHI, H55 Motherboard Mainboard M-ATX Desktop LGA 1156 Mother Board Intel Xeon i3 i5 i7 CPU DDR3 Memory Office Computer Game, 115, https://www.newegg.com/p/1JW-00MK-00062?Description=MotherBoard&cm_re=MotherBoard-_-9SIARGUG691515-_-Product
ASUS, PRIME B550-PLUS AMD Socket B550 AM4 ATX M.2 Desktop Motherboard A, 99, https://www.newegg.com/asus-prime-b550-plus/p/2MG-000B-003B0?Description=MotherBoard&cm_re=MotherBoard-_-2MG-000B-003B0-_-Product
HP, 6005 Pro Microtower SFF original Motherboard 531966-001 503335-001, 63, https://www.newegg.com/p/2HK-0013-00805?Description=MotherBoard&cm_re=MotherBoard-_-9SIAJ5V9902305-_-Product
